{
  "schema_version": 1,
  "operation": "company-ingest",
  "created_at": "2026-08-15T20:20:46.548Z",
  "changes": [
    {
      "company_id": "nero",
      "company_name": "Nero",
      "website_url": "https://nero.fan/",
      "address": null,
      "latitude": null,
      "longitude": null,
      "address_status": "pending",
      "address_source_url": null,
      "address_source_label": null,
      "verified_date": null,
      "added_date": "2026-08-15T20:20:46.548Z",
      "updated_date": "2026-08-15T20:20:46.548Z"
    },
    {
      "company_id": "zero-rfi",
      "company_name": "Zero RFI",
      "website_url": "https://www.zero-rfi.com/",
      "address": null,
      "latitude": null,
      "longitude": null,
      "address_status": "pending",
      "address_source_url": null,
      "address_source_label": null,
      "verified_date": null,
      "added_date": "2026-08-15T20:20:46.548Z",
      "updated_date": "2026-08-15T20:20:46.548Z"
    },
    {
      "company_id": "vyvora",
      "company_name": "Vyvora",
      "website_url": "https://vyvora.app/",
      "address": null,
      "latitude": null,
      "longitude": null,
      "address_status": "pending",
      "address_source_url": null,
      "address_source_label": null,
      "verified_date": null,
      "added_date": "2026-08-15T20:20:46.548Z",
      "updated_date": "2026-08-15T20:20:46.548Z"
    },
    {
      "company_id": "peloras",
      "company_name": "Peloras",
      "website_url": "https://peloras.dev/",
      "address": null,
      "latitude": null,
      "longitude": null,
      "address_status": "pending",
      "address_source_url": null,
      "address_source_label": null,
      "verified_date": null,
      "added_date": "2026-08-15T20:20:46.548Z",
      "updated_date": "2026-08-15T20:20:46.548Z"
    },
    {
      "company_id": "glowops",
      "company_name": "GlowOps",
      "website_url": "https://glowopsai.com/",
      "address": null,
      "latitude": null,
      "longitude": null,
      "address_status": "pending",
      "address_source_url": null,
      "address_source_label": null,
      "verified_date": null,
      "added_date": "2026-08-15T20:20:46.548Z",
      "updated_date": "2026-08-15T20:20:46.548Z"
    },
    {
      "company_id": "https-martini-art",
      "company_name": "https://martini.art/",
      "website_url": "https://martini.art/",
      "address": null,
      "latitude": null,
      "longitude": null,
      "address_status": "pending",
      "address_source_url": null,
      "address_source_label": null,
      "verified_date": null,
      "added_date": "2026-08-15T20:20:46.548Z",
      "updated_date": "2026-08-15T20:20:46.548Z"
    },
    {
      "company_id": "promise-kept",
      "company_name": "Promise Kept Co",
      "website_url": "https://promisekeptco.com/",
      "address": null,
      "latitude": null,
      "longitude": null,
      "address_status": "pending",
      "address_source_url": null,
      "address_source_label": null,
      "verified_date": null,
      "added_date": "2026-08-15T20:20:46.548Z",
      "updated_date": "2026-08-15T20:20:46.548Z"
    },
    {
      "company_id": "assured",
      "company_name": "Assured",
      "website_url": "https://useassured.com/",
      "address": null,
      "latitude": null,
      "longitude": null,
      "address_status": "pending",
      "address_source_url": null,
      "address_source_label": null,
      "verified_date": null,
      "added_date": "2026-08-15T20:20:46.548Z",
      "updated_date": "2026-08-15T20:20:46.548Z"
    },
    {
      "company_id": "lotuspetal-ai",
      "company_name": "LotusPetal AI",
      "website_url": "https://www.lotuspetal.ai/",
      "address": null,
      "latitude": null,
      "longitude": null,
      "address_status": "pending",
      "address_source_url": null,
      "address_source_label": null,
      "verified_date": null,
      "added_date": "2026-08-15T20:20:46.548Z",
      "updated_date": "2026-08-15T20:20:46.548Z"
    },
    {
      "company_id": "mozio",
      "company_name": "Mozio",
      "website_url": "http://www.mozio.com/",
      "address": null,
      "latitude": null,
      "longitude": null,
      "address_status": "pending",
      "address_source_url": null,
      "address_source_label": null,
      "verified_date": null,
      "added_date": "2026-08-15T20:20:46.548Z",
      "updated_date": "2026-08-15T20:20:46.548Z"
    }
  ],
  "issues": []
}
