{
  "schema_version": 1,
  "operation": "company-ingest",
  "created_at": "2026-08-15T20:18:31Z",
  "changes": [
    {
      "company_id": "fonzi",
      "company_name": "Fonzi",
      "website_url": null,
      "address": null,
      "latitude": null,
      "longitude": null,
      "address_status": "pending",
      "address_source_url": null,
      "address_source_label": null,
      "verified_date": null,
      "added_date": "2026-08-15T20:18:31Z",
      "updated_date": "2026-08-15T20:18:31Z"
    },
    {
      "company_id": "miru-fintech",
      "company_name": "Miru - Fintech",
      "website_url": null,
      "address": null,
      "latitude": null,
      "longitude": null,
      "address_status": "pending",
      "address_source_url": null,
      "address_source_label": null,
      "verified_date": null,
      "added_date": "2026-08-15T20:18:31Z",
      "updated_date": "2026-08-15T20:18:31Z"
    },
    {
      "company_id": "activate-games",
      "company_name": "Activate Games",
      "website_url": null,
      "address": null,
      "latitude": null,
      "longitude": null,
      "address_status": "pending",
      "address_source_url": null,
      "address_source_label": null,
      "verified_date": null,
      "added_date": "2026-08-15T20:18:31Z",
      "updated_date": "2026-08-15T20:18:31Z"
    },
    {
      "company_id": "ingenio",
      "company_name": "Ingenio, LLC",
      "website_url": null,
      "address": null,
      "latitude": null,
      "longitude": null,
      "address_status": "pending",
      "address_source_url": null,
      "address_source_label": null,
      "verified_date": null,
      "added_date": "2026-08-15T20:18:31Z",
      "updated_date": "2026-08-15T20:18:31Z"
    },
    {
      "company_id": "bridgebio-pharma",
      "company_name": "BridgeBio Pharma",
      "website_url": null,
      "address": null,
      "latitude": null,
      "longitude": null,
      "address_status": "pending",
      "address_source_url": null,
      "address_source_label": null,
      "verified_date": null,
      "added_date": "2026-08-15T20:18:31Z",
      "updated_date": "2026-08-15T20:18:31Z"
    },
    {
      "company_id": "salesforce",
      "company_name": "Salesforce",
      "website_url": null,
      "address": null,
      "latitude": null,
      "longitude": null,
      "address_status": "pending",
      "address_source_url": null,
      "address_source_label": null,
      "verified_date": null,
      "added_date": "2026-08-15T20:18:31Z",
      "updated_date": "2026-08-15T20:18:31Z"
    },
    {
      "company_id": "inferact",
      "company_name": "Inferact",
      "website_url": null,
      "address": null,
      "latitude": null,
      "longitude": null,
      "address_status": "pending",
      "address_source_url": null,
      "address_source_label": null,
      "verified_date": null,
      "added_date": "2026-08-15T20:18:31Z",
      "updated_date": "2026-08-15T20:18:31Z"
    },
    {
      "company_id": "abby-care",
      "company_name": "Abby Care",
      "website_url": null,
      "address": null,
      "latitude": null,
      "longitude": null,
      "address_status": "pending",
      "address_source_url": null,
      "address_source_label": null,
      "verified_date": null,
      "added_date": "2026-08-15T20:18:31Z",
      "updated_date": "2026-08-15T20:18:31Z"
    },
    {
      "company_id": "crusoe",
      "company_name": "Crusoe",
      "website_url": null,
      "address": null,
      "latitude": null,
      "longitude": null,
      "address_status": "pending",
      "address_source_url": null,
      "address_source_label": null,
      "verified_date": null,
      "added_date": "2026-08-15T20:18:31Z",
      "updated_date": "2026-08-15T20:18:31Z"
    },
    {
      "company_id": "vapi",
      "company_name": "Vapi",
      "website_url": null,
      "address": null,
      "latitude": null,
      "longitude": null,
      "address_status": "pending",
      "address_source_url": null,
      "address_source_label": null,
      "verified_date": null,
      "added_date": "2026-08-15T20:18:31Z",
      "updated_date": "2026-08-15T20:18:31Z"
    },
    {
      "company_id": "chief",
      "company_name": "Chief",
      "website_url": null,
      "address": null,
      "latitude": null,
      "longitude": null,
      "address_status": "pending",
      "address_source_url": null,
      "address_source_label": null,
      "verified_date": null,
      "added_date": "2026-08-15T20:18:31Z",
      "updated_date": "2026-08-15T20:18:31Z"
    },
    {
      "company_id": "judgment-labs",
      "company_name": "Judgment Labs",
      "website_url": null,
      "address": null,
      "latitude": null,
      "longitude": null,
      "address_status": "pending",
      "address_source_url": null,
      "address_source_label": null,
      "verified_date": null,
      "added_date": "2026-08-15T20:18:31Z",
      "updated_date": "2026-08-15T20:18:31Z"
    },
    {
      "company_id": "airwallex",
      "company_name": "Airwallex",
      "website_url": null,
      "address": null,
      "latitude": null,
      "longitude": null,
      "address_status": "pending",
      "address_source_url": null,
      "address_source_label": null,
      "verified_date": null,
      "added_date": "2026-08-15T20:18:31Z",
      "updated_date": "2026-08-15T20:18:31Z"
    }
  ],
  "issues": []
}
