{
  "schema_version": 1,
  "operation": "company-ingest",
  "created_at": "2026-08-15T20:30:18Z",
  "changes": [
    {
      "company_id": "planet",
      "company_name": "Planet",
      "website_url": null,
      "address": null,
      "latitude": null,
      "longitude": null,
      "address_status": "pending",
      "address_source_url": null,
      "address_source_label": null,
      "verified_date": null,
      "added_date": "2026-08-15T20:30:18Z",
      "updated_date": "2026-08-15T20:30:18Z"
    },
    {
      "company_id": "cambium",
      "company_name": "Cambium",
      "website_url": null,
      "address": null,
      "latitude": null,
      "longitude": null,
      "address_status": "pending",
      "address_source_url": null,
      "address_source_label": null,
      "verified_date": null,
      "added_date": "2026-08-15T20:30:18Z",
      "updated_date": "2026-08-15T20:30:18Z"
    },
    {
      "company_id": "strava",
      "company_name": "Strava",
      "website_url": null,
      "address": null,
      "latitude": null,
      "longitude": null,
      "address_status": "pending",
      "address_source_url": null,
      "address_source_label": null,
      "verified_date": null,
      "added_date": "2026-08-15T20:30:18Z",
      "updated_date": "2026-08-15T20:30:18Z"
    },
    {
      "company_id": "sunrun",
      "company_name": "Sunrun Inc",
      "website_url": null,
      "address": null,
      "latitude": null,
      "longitude": null,
      "address_status": "pending",
      "address_source_url": null,
      "address_source_label": null,
      "verified_date": null,
      "added_date": "2026-08-15T20:30:18Z",
      "updated_date": "2026-08-15T20:30:18Z"
    },
    {
      "company_id": "procore-technologies-construction",
      "company_name": "Procore Technologies Construction Private Limited",
      "website_url": null,
      "address": null,
      "latitude": null,
      "longitude": null,
      "address_status": "pending",
      "address_source_url": null,
      "address_source_label": null,
      "verified_date": null,
      "added_date": "2026-08-15T20:30:18Z",
      "updated_date": "2026-08-15T20:30:18Z"
    },
    {
      "company_id": "clera",
      "company_name": "Clera",
      "website_url": null,
      "address": null,
      "latitude": null,
      "longitude": null,
      "address_status": "pending",
      "address_source_url": null,
      "address_source_label": null,
      "verified_date": null,
      "added_date": "2026-08-15T20:30:18Z",
      "updated_date": "2026-08-15T20:30:18Z"
    },
    {
      "company_id": "plaid",
      "company_name": "Plaid",
      "website_url": null,
      "address": null,
      "latitude": null,
      "longitude": null,
      "address_status": "pending",
      "address_source_url": null,
      "address_source_label": null,
      "verified_date": null,
      "added_date": "2026-08-15T20:30:18Z",
      "updated_date": "2026-08-15T20:30:18Z"
    },
    {
      "company_id": "artificial-intelligence-underwriting-company",
      "company_name": "Artificial Intelligence Underwriting Company",
      "website_url": null,
      "address": null,
      "latitude": null,
      "longitude": null,
      "address_status": "pending",
      "address_source_url": null,
      "address_source_label": null,
      "verified_date": null,
      "added_date": "2026-08-15T20:30:18Z",
      "updated_date": "2026-08-15T20:30:18Z"
    },
    {
      "company_id": "dimensional",
      "company_name": "Dimensional Inc.",
      "website_url": null,
      "address": null,
      "latitude": null,
      "longitude": null,
      "address_status": "pending",
      "address_source_url": null,
      "address_source_label": null,
      "verified_date": null,
      "added_date": "2026-08-15T20:30:18Z",
      "updated_date": "2026-08-15T20:30:18Z"
    }
  ],
  "issues": [
    {
      "code": "remote_only_job",
      "company_id": null,
      "subject": "Mercury - Banking for Startups",
      "source_url": "https://startup.jobs/senior-product-designer-cards-credit-mercury-banking-for-startups-8997535",
      "details": "The only reviewed San Francisco listing was explicitly marked REMOTE, so this company was excluded."
    },
    {
      "code": "remote_only_job",
      "company_id": null,
      "subject": "Thumbtack",
      "source_url": "https://startup.jobs/sr-finance-mgr-partnerships-and-special-projects-thumbtack-com-9007083",
      "details": "The only reviewed San Francisco listing was explicitly marked REMOTE, so this company was excluded."
    },
    {
      "code": "remote_only_job",
      "company_id": null,
      "subject": "Snapdocs",
      "source_url": "https://startup.jobs/ar-collections-clerk-contract-snapdocs-com-9006426",
      "details": "The only reviewed San Francisco listing was explicitly marked REMOTE, so this company was excluded."
    },
    {
      "code": "remote_only_job",
      "company_id": null,
      "subject": "Reka",
      "source_url": "https://startup.jobs/program-lead-reka-9004861",
      "details": "The only reviewed San Francisco listing was explicitly marked REMOTE, so this company was excluded."
    },
    {
      "code": "remote_only_job",
      "company_id": null,
      "subject": "Astronomer",
      "source_url": "https://startup.jobs/customer-reliability-engineer-airflow-astronomer-2-9004734",
      "details": "The only reviewed San Francisco listing was explicitly marked REMOTE, so this company was excluded."
    },
    {
      "code": "remote_only_job",
      "company_id": null,
      "subject": "LILT (Production)",
      "source_url": "https://startup.jobs/linguist-romanian-us-based-life-sciences-remote-lilt-production-9004637",
      "details": "The only reviewed San Francisco listing was explicitly marked REMOTE, so this company was excluded."
    },
    {
      "code": "remote_only_job",
      "company_id": null,
      "subject": "Zapier",
      "source_url": "https://startup.jobs/senior-manager-it-zapier-3-9004401",
      "details": "The only reviewed San Francisco listing was explicitly marked REMOTE, so this company was excluded."
    }
  ]
}
